,created_at,tweets,mentioned_company
992,Sat Jan 19 01:16:18 +0000 2019,"rt @dbongino: we called it. fake news!

“more buzzfeed b.s.” https://t.co/aoipjju0vh","News Corp. Class B, Twenty-First Century Fox Class B, "
1006,Fri Jan 18 03:03:24 +0000 2019,"gregg jarrett: “mueller’s prosecutors knew the “dossier” was the product of bias and deception.” it was a fake, just like so much news coverage in our country. nothing but a witch hunt, from beginning to end!","J. B. Hunt Transport Services, "
1010,Fri Jan 18 01:18:04 +0000 2019,"rt @realdonaldtrump: ....i am doing exactly what i pledged to do, and what i was elected to do by the { CITIZENS } of our great country. just a…","Citizens Financial Group, "
1012,Thu Jan 17 15:04:29 +0000 2019,so funny to watch schumer groveling. he called for the firing of bad cop { JAMES } comey many times - until i fired him!,"Raymond James Financial Inc., "
1028,Tue Jan 15 13:01:36 +0000 2019,rt @parisdennard: i trust a rancher on the southern border more than a liberal politician from { NORTHERN } california https://t.co/mo4owe1sni,"Northern Trust Corp., "
1032,Tue Jan 15 12:25:45 +0000 2019,"volkswagen will be spending 800 million dollars in chattanooga, tennessee. they will be making { ELECTRIC } cars. congratulations to chattanooga and tennessee on a job well done. a big win!","American Electric Power, Emerson Electric Company, General Electric, "
1034,Tue Jan 15 11:58:52 +0000 2019,the rank and file of the fbi are great people who are disgusted with what they are learning about lyin’ { JAMES } comey and the so-called “leaders” of the fbi. twelve have been fired or forced to leave. they got caught spying on my campaign and then called it an investigation. bad!,"Raymond James Financial Inc., "
1035,Mon Jan 14 22:19:50 +0000 2019,"....i am doing exactly what i pledged to do, and what i was elected to do by the { CITIZENS } of our great country. just as i promised, i am fighting for you!","Citizens Financial Group, "
1056,Mon Jan 14 03:03:03 +0000 2019,"best line in the elizabeth warren beer catastrophe is, to her husband, “thank you for being here. i’m glad you’re here” it’s their house, he’s supposed to be there!","Everest Re Group Ltd., "
1059,Mon Jan 14 01:45:10 +0000 2019,"so sorry to hear the news about jeff bozo being taken down by a competitor whose reporting, i understand, is far more accurate than the reporting in his lobbyist newspaper, the amazon washington post. hopefully the { PAPER } will soon be placed in better &amp; more responsible hands!","International Paper, "
1060,Sun Jan 13 23:02:56 +0000 2019,"....likewise, do not want the kurds to provoke turkey. russia, iran and syria have been the biggest beneficiaries of the long term u.s. policy of destroying isis in syria - { NATURAL } enemies. we also benefit but it is now time to bring our troops back home. stop the endless wars!","Fortune Brands Home & Security, Home Depot, Pioneer Natural Resources, "
1063,Sun Jan 13 15:45:45 +0000 2019,"thousands of illegal aliens who have committed sexual crimes against children are right now in texas prisons. most came through our southern border. we can end this easily - we need a steel barrier or wall. walls work! john jones, texas department of { PUBLIC } safety.  @foxnews","Public Serv. Enterprise Inc., Public Storage, "
1076,Sat Jan 12 14:20:33 +0000 2019,"lyin’ { JAMES } comey, andrew mccabe, peter s and his lover, agent lisa page, &amp; more, all disgraced and/or fired and caught in the act. these are just some of the losers that tried to do a number on your president. part of the witch hunt. remember the “insurance policy?” this is it!","J. B. Hunt Transport Services, Raymond James Financial Inc., "
1079,Sat Jan 12 12:33:30 +0000 2019,....the fbi was in complete turmoil (see n.y. post) because of comey’s poor leadership and the way he handled the clinton mess (not to mention his usurpation of powers from the justice department). my firing of { JAMES } comey was a great day for america. he was a crooked cop......,"Raymond James Financial Inc., "
1080,Sat Jan 12 12:18:35 +0000 2019,"...funny thing about { JAMES } comey. everybody wanted him fired, republican and democrat alike. after the rigged &amp; botched crooked hillary investigation, where she was interviewed on july 4th weekend, not recorded or sworn in, and where she said she didn’t know anything (a lie),....","Raymond James Financial Inc., "
1081,Sat Jan 12 12:05:36 +0000 2019,"wow, just learned in the failing new york times that the corrupt former leaders of the fbi, almost all fired or forced to leave the agency for some very bad reasons, opened up an investigation on me, for no reason &amp; with no proof, after i fired lyin’ { JAMES } comey, a total sleaze!","Raymond James Financial Inc., "
1083,Fri Jan 11 23:21:41 +0000 2019,"drug prices declined in 2018, the first time in nearly { HALF } a century. during the first 19 months of my administration, americans saved $26 billion on prescription drugs. our policies to get cheaper generic drugs to market are working!","Robert Half International, Twenty-First Century Fox Class A, Twenty-First Century Fox Class B, "
1090,Fri Jan 11 12:40:30 +0000 2019,"h1-b holders in the united states can rest assured that changes are soon coming which will bring both simplicity and certainty to your stay, including a potential path to citizenship. we want to encourage talented and highly skilled people to pursue career options in the u.s.","News Corp. Class B, Twenty-First Century Fox Class B, "
1110,Thu Jan 10 03:55:30 +0000 2019,"rt @charliekirk11: this is why we need a wall

illegal immigration is a serious threat to our country

90% of all heroin comes across the b…","News Corp. Class B, Twenty-First Century Fox Class B, "
1113,Wed Jan 09 20:34:46 +0000 2019,"just left a meeting with chuck and nancy, a total { WASTE } of time. i asked what is going to happen in 30 days if i quickly open things up, are you going to approve border security which includes a wall or steel barrier? nancy said, no. i said bye-bye, nothing else works!","American Water Works Company Inc, Illinois Tool Works, Waste Management Inc., "
1115,Wed Jan 09 15:25:43 +0000 2019,"billions of dollars are sent to the state of california for forest fires that, with proper forest management, would never happen. unless they get their act together, which is unlikely, i have ordered fema to send no more money. it is a disgraceful situation in lives &amp; money!","Apartment Investment & Management, Waste Management Inc., "
1116,Wed Jan 09 14:36:05 +0000 2019,"billions of dollars are sent to the state of california for forrest fires that, with proper forrest management, would never happen. unless they get their act together, which is unlikely, i have ordered fema to send no more money. it is a disgraceful situation in lives &amp; money!","Apartment Investment & Management, Waste Management Inc., "
1127,Mon Jan 07 13:38:34 +0000 2019,"congressman adam smith, the new chairman of the house armed services committee, just stated, “yes, there is a provision in law that says a president can declare an emergency. it’s been done a number of times.” no doubt, but let’s get our deal done in congress!","A.O. Smith Corp, "
1142,Sun Jan 06 01:00:30 +0000 2019,"“jobs up big, plus 312,000. record number working. manufacturing best in 20 years (previous administration said this could not happen). hispanic unemployment lowest ever. { DOW } plus 747 (for day).” @drudge_report","Dow Inc., "
1145,Sat Jan 05 17:27:18 +0000 2019,"“former @nytimes editor jill abramson rips paper's ‘unmistakably anti-trump’ bias.”

ms. abramson is 100% correct. horrible and totally dishonest reporting on almost everything they write. hence the term fake news, enemy of the people, and opposition party!","International Paper, "
1154,Sat Jan 05 01:10:43 +0000 2019,"great new book by dr. { ROBERT } jeffress, “choosing the extraordinary life.” get it and enjoy!  @loudobbs","Robert Half International, "
1167,Thu Jan 03 14:36:57 +0000 2019,“maga list: 205 ‘historic results’ help trump make case for 2020 re-election” https://t.co/vtqnuwdhjb,"Everest Re Group Ltd., "
1176,Tue Jan 01 22:51:12 +0000 2019,washington examiner - “maga list: 205 ‘historic results’ help trump make case for 2020 re-election.”  true!,"Everest Re Group Ltd., "
1200,Mon Dec 31 14:38:52 +0000 2018,"i am the only person in america who could say that, “i’m bringing our great troops back home, with victory,” and get bad press. it is fake news and pundits who have failed for years that are doing the complaining. if i stayed in endless wars forever, they would still be unhappy!","Fortune Brands Home & Security, Home Depot, "
1204,Mon Dec 31 13:03:05 +0000 2018,"if anybody but donald trump did what i did in syria, which was an isis loaded mess when i became president, they would be a national hero. isis is mostly gone, we’re slowly sending our troops back { HOME } to be with their families, while at the same time fighting isis remnants......","Everest Re Group Ltd., Fortune Brands Home & Security, Home Depot, "
1206,Sun Dec 30 21:59:44 +0000 2018,"president and mrs. obama built/has a ten { FOOT } wall around their d.c. mansion/compound. i agree, totally necessary for their safety and security. the u.s. needs the same thing, slightly larger version!","Foot Locker Inc, "
1217,Sat Dec 29 15:42:50 +0000 2018,"the mueller angry democrats recently deleted approximately 19,000 text messages between fbi agent lisa page and her lover, agent peter s. these texts were asked for and invaluable to the truth of the witch { HUNT } hoax. this is a total obstruction of justice. all texts demanded!","J. B. Hunt Transport Services, "
1223,Thu Dec 27 23:23:36 +0000 2018,"cnn &amp; others within the fake news universe were going wild about my signing maga hats for our military in iraq and germany. if these brave young people ask me to sign their hat, i will sign. can you imagine my saying no? we brought or gave no hats as the fake news first reported!","Red Hat Inc., "
1224,Thu Dec 27 22:10:07 +0000 2018,"this isn’t about the wall, everybody knows that a wall will work perfectly (in israel the wall { WORKS } 99.9%). this is only about the dems not letting donald trump &amp; the republicans have a win. they may have the 10 senate votes, but we have the issue, border security. 2020!","American Water Works Company Inc, Illinois Tool Works, "
1236,Tue Dec 25 23:18:44 +0000 2018,"i hope everyone, even the fake news media, is having a great christmas! our country is doing very well. we are securing our borders, making great new trade deals, and bringing our troops back home. we are finally putting america first. merry christmas!  #maga","Fortune Brands Home & Security, Home Depot, "
1251,Mon Dec 24 04:54:00 +0000 2018,"president @rt_erdogan of turkey has very strongly informed me that he will eradicate whatever is left of isis in syria....and he is a man who can do it plus, turkey is right “next door.” our troops are coming home!","Fortune Brands Home & Security, Home Depot, "
1252,Mon Dec 24 04:26:22 +0000 2018,"“the president has been remarkable. i do not doubt that he will thrive in this new environment, and he will be a constant reminder of what populism is.” thank you to tammy bruce and steve hilton. presidential harassment has been with me from the beginning!","Hilton Worldwide Holdings Inc, "
1258,Sun Dec 23 20:20:22 +0000 2018,".....bob corker was responsible for giving us the horrible iran nuclear deal, which i ended, yet he badmouths me for wanting to bring our young people safely back home. bob wanted to run and asked for my endorsement. i said no and the game was over. #maga i love tennessee!","Fortune Brands Home & Security, Home Depot, "
1260,Sun Dec 23 19:45:22 +0000 2018,"we signed two pieces of major legislation this week, criminal justice reform and the farm bill. these are two big deals, but all the fake news media wants to talk about is “the mistake” of bringing our young people back { HOME } from the never ending wars. it all began 19 years ago!","Fortune Brands Home & Security, Home Depot, "
1262,Sun Dec 23 16:59:22 +0000 2018,"i just had a long and productive call with president @rt_erdogan of turkey. we discussed isis, our mutual involvement in syria, &amp; the slow &amp; highly coordinated pullout of u.s. troops from the area. after many years they are coming home. we also discussed heavily expanded trade.","Fortune Brands Home & Security, Home Depot, "
1263,Sun Dec 23 16:46:47 +0000 2018,"i am pleased to announce that our very talented deputy secretary of defense, patrick shanahan, will assume the title of acting secretary of defense starting january 1, 2019. patrick has a long list of accomplishments while serving as deputy, &amp; previously boeing. he will be great!","Boeing Company, "
1264,Sun Dec 23 14:17:54 +0000 2018,"the only way to stop drugs, gangs, human trafficking, criminal elements and much else from coming into our country is with a wall or barrier. drones and all of the rest are wonderful and lots of fun, but it is only a good old fashioned wall that works!","American Water Works Company Inc, Illinois Tool Works, "
1266,Sun Dec 23 01:59:29 +0000 2018,"if anybody but your favorite president, donald j. trump, announced that, after decimating isis in syria, we were going to bring our troops back { HOME } (happy &amp; healthy), that person would be the most popular hero in america. with me, hit hard instead by the fake news media. crazy!","Fortune Brands Home & Security, Home Depot, "
1273,Sat Dec 22 16:30:35 +0000 2018,"....going to be there for three months, and that was seven years ago - we never left. when i became president, isis was going wild. now isis is largely defeated and other local countries, including turkey, should be able to easily take care of whatever remains. we’re coming home!","Everest Re Group Ltd., Fortune Brands Home & Security, Home Depot, "
1279,Fri Dec 21 22:14:14 +0000 2018,a { DESIGN } of our steel slat barrier which is totally effective while at the same time beautiful! https://t.co/sgltxh0cu9,"Cadence Design Systems, "
1302,Thu Dec 20 19:22:19 +0000 2018,"so hard to believe that lindsey graham would be against saving soldier lives &amp; billions of $$$. why are we fighting for our enemy, syria, by staying &amp; killing isis for them, russia, iran &amp; other locals? time to focus on our country &amp; bring our youth back { HOME } where they belong!","Fortune Brands Home & Security, Home Depot, "
1305,Thu Dec 20 12:41:08 +0000 2018,"rt @realdonaldtrump: after historic victories against isis, it’s time to bring our great young people home! https://t.co/xonjfzqftp","Fortune Brands Home & Security, Home Depot, "
1310,Thu Dec 20 11:42:57 +0000 2018,"getting out of syria was no surprise. i’ve been campaigning on it for years, and six months ago, when i very publicly wanted to do it, i agreed to stay longer. russia, iran, syria &amp; others are the local enemy of isis. we were doing there work. time to come { HOME } &amp; rebuild. #maga","Fortune Brands Home & Security, Home Depot, "
1313,Thu Dec 20 05:04:05 +0000 2018,"col. jim carafano on @ingrahamangle “trump has made the middle east a better place. when trump came into office, isis was running amuck in the middle east. over a million refugees poured into { WESTERN } europe - none of that is happening today. that’s all due to trump.”","Western Digital, Western Union Co, "
1315,Wed Dec 19 23:10:35 +0000 2018,"after historic victories against isis, it’s time to bring our great young people home! https://t.co/xonjfzqftp","Fortune Brands Home & Security, Home Depot, "
1324,Wed Dec 19 02:07:01 +0000 2018,"america is the greatest country in the world and my job is to fight for all citizens, even those who have made mistakes. congratulations to the senate on the bi-partisan passing of a historic criminal justice reform bill....","Citizens Financial Group, "
1325,Wed Dec 19 01:13:30 +0000 2018,"....it will be beautiful and, at the same time, give our country the security that our { CITIZENS } deserve. it will go up fast and save us billions of dollars a month once completed!","Citizens Financial Group, "
1332,Tue Dec 18 13:22:29 +0000 2018,"....will never be proven and are likely false.”  thank you to michael isikoff, yahoo, for honesty. what this means is that the fisa warrants and the whole russian witch { HUNT } is a fraud and a hoax which should be ended immediately. also, it was paid for by crooked hillary &amp; dnc!","J. B. Hunt Transport Services, "
1336,Tue Dec 18 12:13:24 +0000 2018,"i hope the people over at the fed will read today’s wall street journal editorial before they make yet another mistake. also, don’t let the market become any more illiquid than it already is. stop with the 50 b’s. feel the market, don’t just go by meaningless numbers. good luck!","News Corp. Class B, Twenty-First Century Fox Class B, "
1338,Tue Dec 18 11:28:39 +0000 2018,"biggest outrage yet in the long, winding and highly conflicted mueller witch { HUNT } is the fact that 19,000 demanded text messages between peter strzok and his fbi lover, lisa page, were purposely &amp; illegally deleted. would have explained whole hoax, which is now under protest!","J. B. Hunt Transport Services, "
1339,Mon Dec 17 21:14:10 +0000 2018,today i am making good on my promise to defend our farmers &amp; ranchers from unjustified trade retaliation by foreign nations. i have authorized secretary perdue to implement the 2nd round of market facilitation payments. our economy is stronger than ever–we stand with our farmers!,"Global Payments Inc., "
1342,Mon Dec 17 13:27:16 +0000 2018,"it is incredible that with a very strong { DOLLAR } and virtually no inflation, the outside world blowing up around us, paris is burning and china way down, the fed is even considering yet another interest rate hike. take the victory!","Dollar General, Dollar Tree, "
1345,Sun Dec 16 20:56:33 +0000 2018,"....the russian witch { HUNT } hoax, started as the “insurance policy” long before i even got elected, is very bad for our country. they are entrapping people for misstatements, lies or unrelated things that took place many years ago. nothing to do with collusion. a democrat scam!","J. B. Hunt Transport Services, "
1346,Sun Dec 16 20:37:17 +0000 2018,"....a persecution of the president.”  daniel henninger, the wall street journal. thank you, people are starting to see and understand what this witch { HUNT } is all about. jeff sessions should be ashamed of himself for allowing this total hoax to get started in the first place!","J. B. Hunt Transport Services, "
1353,Sun Dec 16 14:39:50 +0000 2018,"remember, michael cohen only became a “rat” after the fbi did something which was absolutely unthinkable &amp; unheard of until the witch { HUNT } was illegally started. they broke into an attorney’s office! why didn’t they break into the dnc to get the server, or crooked’s office?","J. B. Hunt Transport Services, "
1354,Sun Dec 16 14:11:52 +0000 2018,"so where are all the missing text messages between fired fbi agents peter s and the lovely lisa page, his lover. just reported that they have been erased and wiped clean. what an outrage as the totally compromised and conflicted witch { HUNT } moves ever so slowly forward. want them!","J. B. Hunt Transport Services, "
1356,Sat Dec 15 16:45:12 +0000 2018,"wow, 19,000 texts between lisa page and her lover, peter s of the fbi, in charge of the russia hoax, were just reported as being wiped clean and gone. such a big story that will never be covered by the fake news. witch hunt!","J. B. Hunt Transport Services, "
1365,Fri Dec 14 22:18:15 +0000 2018,"i am pleased to announce that mick mulvaney, director of the office of { MANAGEMENT } &amp; budget, will be named acting white house chief of staff, replacing general john kelly, who has served our country with distinction. mick has done an outstanding job while in the administration....","Apartment Investment & Management, Waste Management Inc., "
1377,Thu Dec 13 16:08:16 +0000 2018,witch hunt!,"J. B. Hunt Transport Services, "
1389,Tue Dec 11 18:50:29 +0000 2018,"james comey just totally exposed his partisan stance by urging his fellow democrats to take back the white house in 2020. in other words, he is and has been a democrat. comey had no right heading the fbi at any time, but especially after his mind exploded!","Raymond James Financial Inc., "
1398,Tue Dec 11 02:28:25 +0000 2018,“former fbi director { JAMES } comey under fire for his testimony acknowledging he knew that the democrats paid for that phony trump dossier.” @loudobbs  details on tuesday night.,"Raymond James Financial Inc., "
1399,Tue Dec 11 02:11:21 +0000 2018,"james comey’s behind closed doors testimony reveals that “there was not evidence of campaign collusion” with russia when he left the fbi. in other words, the witch { HUNT } is illegal and should never have been started!","J. B. Hunt Transport Services, Raymond James Financial Inc., "
1400,Mon Dec 10 12:00:00 +0000 2018,"....which it was not (but even if it was, it is only a civil case, like obama’s - but it was done correctly by a lawyer and there would not even be a fine. lawyer’s liability if he made a mistake, not me). cohen just trying to get his sentence reduced. witch hunt!","J. B. Hunt Transport Services, "
1401,Mon Dec 10 11:46:11 +0000 2018,"“democrats can’t find a smocking gun tying the trump campaign to russia after { JAMES } comey’s testimony. no smocking gun...no collusion.” @foxnews  that’s because there was no collusion. so now the dems go to a simple private transaction, wrongly call it a campaign contribution,...","Raymond James Financial Inc., "
1404,Sun Dec 09 13:53:30 +0000 2018,leakin’ { JAMES } comey must have set a record for who lied the most to congress in one day. his friday testimony was so untruthful! this whole deal is a rigged fraud headed up by dishonest people who would do anything so that i could not become president. they are now exposed!,"Raymond James Financial Inc., "
1405,Sun Dec 09 13:38:22 +0000 2018,"on 245  occasions, former fbi director { JAMES } comey told house investigators he didn’t know, didn’t recall, or couldn’t remember things when asked. opened investigations on 4 americans (not 2) - didn’t know who signed off and didn’t know christopher steele. all lies!","Raymond James Financial Inc., "
1412,Sat Dec 08 16:01:39 +0000 2018,"“this is collusion illusion, there is no smoking gun here. at this late date, after all that we have gone through, after millions have been spent, we have no russian collusion. there is nothing impeachable here.” @geraldorivera  time for the witch { HUNT } to end!","J. B. Hunt Transport Services, "
1417,Sat Dec 08 12:34:04 +0000 2018,"the paris agreement isn’t working out so well for paris. protests and riots all over france. people do not want to pay large sums of money, much to { THIRD } world countries (that are questionably run), in order to maybe protect the environment. chanting “we want trump!” love france.","Fifth Third Bancorp, "
1420,Fri Dec 07 21:49:01 +0000 2018,it is being reported that leakin' { JAMES } comey was told by department of justice attorneys not to answer the most important questions. total bias and corruption at the highest levels of previous administration. force him to answer the questions under oath!,"Raymond James Financial Inc., "
1429,Fri Dec 07 13:39:36 +0000 2018,"it has been incorrectly reported that rudy giuliani and others will not be doing a counter to the mueller report. that is fake news. already 87 pages done, but obviously cannot complete until we see the final witch { HUNT } report.","J. B. Hunt Transport Services, "
1432,Fri Dec 07 11:53:34 +0000 2018,"....foundation be listed at the top of the report? will the scathing document written about lyin’ { JAMES } comey, by the man in charge of the case, rod rosenstein (who also signed the fisa warrant), be a big part of the report? isn’t rod therefore totally conflicted? will all of....","Raymond James Financial Inc., "
1434,Fri Dec 07 11:28:50 +0000 2018,"....will { ROBERT } mueller’s big time conflicts of interest be listed at the top of his republicans only report. will andrew weissman’s horrible and vicious prosecutorial past be listed in the report. he wrongly destroyed people’s lives, took down great companies, only to be........","Robert Half International, "
1435,Fri Dec 07 11:18:59 +0000 2018,"robert mueller and leakin’ lyin’ { JAMES } comey are best friends, just one of many mueller conflicts of interest. and bye the way, wasn’t the woman in charge of prosecuting jerome corsi (who i do not know) in charge of “legal” at the corrupt clinton foundation? a total witch hunt...","J. B. Hunt Transport Services, Raymond James Financial Inc., Robert Half International, "
1438,Fri Dec 07 03:07:18 +0000 2018,trish_regan:  “did the fbi follow protocol to obtain the fisa warrant? i don’t think so. the dossier was opposition { RESEARCH } funded by opponents. don’t use government resources to take down political foes. weaponizing government for gain.” is this really america? witch hunt!,"J. B. Hunt Transport Services, Lam Research, "
1439,Fri Dec 07 02:58:43 +0000 2018,"jerome corsi: ”this is not justice, this is not america. this is a political prosecution. the special prosecutor (counsel), to get this plea deal, demanded i lie and violate the law. they’re the criminals.” he is not alone. 17 angry dems. people forced to lie. sad!  @trish_regan","Everest Re Group Ltd., "
