,created_at,tweets,mentioned_company
3742,Sun May 27 12:41:24 +0000 2018,"who’s going to give back the young and beautiful lives (and others) that have been devastated and destroyed by the phony russia collusion witch hunt? they journeyed down to washington, d.c., with stars in their eyes and wanting to help our nation...they went back { HOME } in tatters!","Fortune Brands Home & Security, Home Depot, J. B. Hunt Transport Services, "
3743,Sun May 27 01:49:54 +0000 2018,welcome { HOME } josh! https://t.co/2x0cke4stx,"Fortune Brands Home & Security, Home Depot, "
3749,Sat May 26 14:47:14 +0000 2018,"thanks to very brave teacher &amp; hero jason seaman of noblesville, indiana, for his heroic act in saving so many precious young lives. his quick and { AUTOMATIC } action is being talked about all over the world!","Automatic Data Processing, "
3755,Fri May 25 23:07:19 +0000 2018,"senator schumer and obama administration let phone company zte flourish with no security checks. i closed it down then let it reopen with high level security guarantees, change of { MANAGEMENT } and board, must purchase u.s. parts and pay a $1.3 billion fine. dems do nothing....","Apartment Investment & Management, Waste Management Inc., "
3758,Fri May 25 20:39:26 +0000 2018,"to the @navalacademy { CLASS } of 2018, i say: we know you are up to the task. we know you will make us proud. we know that glory will be yours. because you are winners, you are warriors, you are fighters, you are champions, and you will lead us to victory! god bless the u.s.a.! https://t.co/v9tgeo8my4","Alphabet Inc Class A, Alphabet Inc Class C, Discovery Inc. Class A, Discovery Inc. Class C, News Corp. Class A, News Corp. Class B, Twenty-First Century Fox Class A, Twenty-First Century Fox Class B, Under Armour Class A, Under Armour Class C, "
3763,Fri May 25 12:04:19 +0000 2018,"“everyone knows there was a spy, and in fact the people who were involved in the spying are admitting that there was a spy...widespread spying involving multiple people.” mollie hemingway, the federalist senior editor  but the corrupt mainstream media hates this { MONSTER } story!","Monster Beverage, "
3764,Fri May 25 12:04:17 +0000 2018,"can anyone even imagine having spies placed in a competing campaign, by the people and party in absolute power, for the sole purpose of political advantage and gain? and to think that the party in question, even with the expenditure of far more money, lost!","American Electric Power, "
3765,Fri May 25 12:04:16 +0000 2018,"the democrats are now alluding to the the concept that having an informant placed in an opposing party’s campaign is different than having a spy, as illegal as that may be. but what about an “informant” who is paid a { FORTUNE } and who “sets up” way earlier than the russian hoax?","Fortune Brands Home & Security, "
3768,Fri May 25 09:13:35 +0000 2018,"rt @scavino45: last week after visiting flotus melania, potus trump went to visit wounded heroes at walter reed { MEDICAL } center. he told the…","Varian Medical Systems, "
3769,Fri May 25 09:12:57 +0000 2018,"rt @scavino45: today, president trump issued an executive grant of clemency (full pardon) posthumously to john { ARTHUR } “jack” johnson, the f…","Arthur J. Gallagher & Co., Jack Henry & Associates Inc, Johnson & Johnson, Johnson Controls International, "
3775,Thu May 24 16:24:38 +0000 2018,"it was my great honor to { HOST } a roundtable re: ms-13 yesterday in bethpage, new york. democrats must abandon their resistance to border security so that we can support law enforcement and save innocent lives! https://t.co/pxe9z4efyz","Everest Re Group Ltd., Host Hotels & Resorts, "
3787,Wed May 23 13:34:06 +0000 2018,witch hunt!,"J. B. Hunt Transport Services, "
3791,Wed May 23 11:33:59 +0000 2018,"“trump should be happy that the fbi was spying on his campaign” no, { JAMES } clapper, i am not happy. spying on a campaign would be illegal, and a scandal to boot!","Raymond James Financial Inc., "
3810,Mon May 21 11:27:42 +0000 2018,china has agreed to { BUY } massive amounts of additional farm/agricultural { PRODUCTS } - would be one of the best things to happen to our farmers in many years!,"Air Products & Chemicals Inc, Best Buy Co. Inc., Maxim Integrated Products Inc, "
3811,Mon May 21 11:21:29 +0000 2018,"i ask senator chuck schumer, why didn’t president obama &amp; the democrats do something about trade with china, including theft of intellectual { PROPERTY } etc.? they did nothing! with that being said, chuck &amp; i have long agreed on this issue! fair trade, plus, with china will happen!","Essex Property Trust, Inc., Simon Property Group Inc, "
3814,Sun May 20 17:13:47 +0000 2018,the witch { HUNT } finds no collusion with russia - so now they’re looking at the rest of the world. oh’ great!,"Everest Re Group Ltd., J. B. Hunt Transport Services, "
3816,Sun May 20 13:37:34 +0000 2018,"what ever happened to the server, at the center of so much corruption, that the democratic national committee refused to hand over to the hard charging (except in the case of democrats) fbi? they broke into { HOMES } &amp; offices early in the morning, but were afraid to take the server?","Pulte Homes Inc., "
3817,Sun May 20 13:29:32 +0000 2018,"now that the witch { HUNT } has given up on russia and is looking at the rest of the world, they should easily be able to take it into the mid-term elections where they can put some hurt on the republican party. don’t worry about dems fisa abuse, missing emails or fraudulent dossier!","J. B. Hunt Transport Services, "
3819,Sun May 20 13:11:05 +0000 2018,"....at what point does this soon to be $20,000,000 witch hunt, composed of 13 angry and heavily conflicted democrats and two people who have worked for obama for 8 years, stop! they have found no collussion with russia, no obstruction, but they aren’t looking at the corruption...","J. B. Hunt Transport Services, "
3820,Sun May 20 13:04:21 +0000 2018,things are really getting ridiculous. the failing and crooked (but not as crooked as hillary clinton) @nytimes has done a long &amp; boring story indicating that the world’s most expensive witch { HUNT } has found nothing on russia &amp; me so now they are looking at the rest of the world!,"J. B. Hunt Transport Services, "
3822,Sat May 19 18:37:39 +0000 2018,great to have our incredible first lady back { HOME } in the white house. melania is feeling and doing really well. thank you for all of your prayers and best wishes!,"Fortune Brands Home & Security, Home Depot, "
3823,Sat May 19 18:33:05 +0000 2018,great to have our incredible first lady back { HOME } in the white house. melanie is feeling and doing really well. thank you for all of your prayers and best wishes!,"Fortune Brands Home & Security, Home Depot, "
3829,Fri May 18 20:22:25 +0000 2018,america is a nation that believes in the { POWER } of redemption. america is a nation that believes in second chances - and america is a nation that believes that the best is always yet to come! #prisonreform https://t.co/yk5ujuyghn,"American Electric Power, "
3830,Fri May 18 20:02:49 +0000 2018,rt @steveforbesceo: .@realdonaldtrump speech on drug costs pays immediate dividends. new @amgen drug lists at 30% less than expected. middl…,"Amgen Inc., "
3838,Thu May 17 22:17:08 +0000 2018,it was my great honor to visit with our heroes last night at walter reed { MEDICAL } center. there is nobody like them! https://t.co/fg5w1swihk,"Varian Medical Systems, "
3843,Thu May 17 15:25:57 +0000 2018,congrats to the house for passing the va mission act yesterday. without this funding our veterans will be forced to stand in never ending { LINES } in order to receive care. putting politics over our veterans care is unacceptable – senate must vote yes on this bill by memorial day!,"Delta Air Lines Inc., "
3844,Thu May 17 13:52:44 +0000 2018,"despite the disgusting, illegal and unwarranted witch hunt, we have had the most successful first 17 month administration in u.s. history - by far! sorry to the fake news media and “haters,” but that’s the way it is!","J. B. Hunt Transport Services, "
3847,Thu May 17 11:28:09 +0000 2018,"congratulations america, we are now into the second year of the greatest witch { HUNT } in american history...and there is still no collusion and no obstruction. the only collusion was that done by democrats who were unable to win an election despite the spending of far more money!","J. B. Hunt Transport Services, "
3850,Wed May 16 18:40:35 +0000 2018,"lou barletta will be a great senator for pennsylvania but his opponent, bob casey, has been a do-nothing senator who only shows up at election time. he votes along the nancy pelosi, elizabeth warren lines, loves sanctuary cities, bad and expensive healthcare...","Delta Air Lines Inc., "
3862,Tue May 15 14:08:21 +0000 2018,"can you believe that with all of the made up, unsourced stories i get from the fake news media, together with the  $10,000,000 russian witch { HUNT } (there is no collusion), i now have my best poll numbers in a year. much of the media may be corrupt, but the people truly get it!","J. B. Hunt Transport Services, "
3867,Mon May 14 21:09:16 +0000 2018,"heading over to walter reed { MEDICAL } center to see our great first lady, melania. successful procedure, she is in good spirits. thank you to all of the well-wishers!","Varian Medical Systems, "
3878,Sat May 12 22:20:16 +0000 2018,"the senate should get funding done before the august break, or not go home. wall and border security should be included. also waiting for approval of almost 300 nominations, worst in history. democrats are doing everything possible to obstruct, all they know how to do. stay!","Fortune Brands Home & Security, Home Depot, "
3884,Fri May 11 19:30:16 +0000 2018,"today, my administration is launching the most sweeping action in history to lower the { PRICE } of prescription drugs for the american people. we will have tougher negotiation, more competition, and much lower prices at the pharmacy counter! https://t.co/xdakx43a4d","T. Rowe Price Group, "
3889,Thu May 10 10:01:43 +0000 2018,"on behalf of the american people, welcome home! https://t.co/hisaci95cb","Fortune Brands Home & Security, Home Depot, "
3909,Mon May 07 13:35:32 +0000 2018,"is this phony witch { HUNT } going to go on even longer so it wrongfully impacts the mid-term elections, which is what the democrats always intended? republicans better get tough and smart before it is too late!","J. B. Hunt Transport Services, "
3910,Mon May 07 13:29:49 +0000 2018,"lisa page, who may hold the record for the most emails in the shortest period of time (to her lover, peter s), and attorney baker, are out at the fbi as part of the probers getting caught? why is peter s still there? what a total mess. our country has to get back to business!","Baker Hughes, a GE Company, "
3913,Mon May 07 11:39:53 +0000 2018,the 13 angry democrats in charge of the russian witch { HUNT } are starting to find out that there is a court system in place that actually protects people from injustice...and just wait ‘till the courts get to see your unrevealed conflicts of interest!,"J. B. Hunt Transport Services, "
3914,Mon May 07 11:27:34 +0000 2018,"the russia witch { HUNT } is rapidly losing credibility. house intelligence committee found no collusion, coordination or anything else with russia. so now the probe says ok, what else is there? how about obstruction for a made up, phony crime.there is no o, it’s called fighting back","J. B. Hunt Transport Services, "
3919,Sat May 05 00:17:34 +0000 2018,"just returned { HOME } to the beautiful white house, from dallas, where the arena was packed to the rafters with the great fans and supporters of the @nra. it was so wonderful to be there!","Fortune Brands Home & Security, Home Depot, "
3923,Fri May 04 21:58:44 +0000 2018,democrats and liberals in congress want to disarm law-abiding americans at the same time they are releasing dangerous criminal aliens and savage gang members onto our streets. politicians who put criminal aliens before american { CITIZENS } should be voted out of office!,"Citizens Financial Group, "
3925,Fri May 04 13:27:50 +0000 2018,"just out: 3.9% unemployment. 4% is broken! in the meantime, witch hunt!","J. B. Hunt Transport Services, "
3927,Fri May 04 10:45:31 +0000 2018,"nbc news is wrong again! they cite “sources” which are constantly wrong. problem is, like so many others, the sources probably don’t exist, they are fabricated, fiction! nbc, my former { HOME } with the apprentice, is now as bad as fake news cnn. sad!","Fortune Brands Home & Security, Home Depot, "
3941,Wed May 02 20:27:47 +0000 2018,"i have been briefed on the u.s. c-130 “hercules” cargo plane from the puerto rico national guard that crashed near savannah { HILTON } head international airport. please join me in thoughts and prayers for the victims, their families and the great men and women of the national guard.","Hilton Worldwide Holdings Inc, "
3944,Wed May 02 13:33:41 +0000 2018,new book - a must read! “the russia hoax - the illicit scheme to clear hillary clinton and frame donald trump” by the brilliant { FOX } news legal analyst gregg jarrett. a sad chapter for law enforcement. a rigged system!,"Twenty-First Century Fox Class A, Twenty-First Century Fox Class B, "
3945,Wed May 02 13:23:17 +0000 2018,"“the questions are an intrusion into the president’s article 2  powers under the constitution to fire any executive branch employee...what the president was thinking is an outrageous.....as to the president’s unfettered { POWER } to fire anyone...” joe digenova, former us attorney","American Electric Power, "
3946,Wed May 02 11:45:08 +0000 2018,"there was no collusion (it is a hoax) and there is no obstruction of justice (that is a setup &amp; trap). what there is is negotiations going on with north korea over nuclear war, negotiations going on with china over trade deficits, negotiations on nafta, and much more. witch hunt!","J. B. Hunt Transport Services, "
3947,Tue May 01 19:42:58 +0000 2018,"today, it was my great honor to thank and welcome heroic crew members and passengers of { SOUTHWEST } { AIRLINES } flight 1380 at the @whitehouse! https://t.co/fyygwtoddi","American Airlines Group, Southwest Airlines, "
3951,Tue May 01 11:34:13 +0000 2018,it would seem very hard to obstruct justice for a crime that never happened! witch hunt!,"J. B. Hunt Transport Services, "
3953,Tue May 01 10:47:30 +0000 2018,"so disgraceful that the questions concerning the russian witch { HUNT } were “leaked” to the media. no questions on collusion. oh, i see...you have a made up, phony crime, collusion, that never existed, and an investigation begun with illegally leaked classified information. nice!","Fidelity National Information Services, J. B. Hunt Transport Services, "
3959,Mon Apr 30 12:19:33 +0000 2018,"numerous countries are being considered for the meeting, but would peace house/freedom house, on the border of north &amp; south korea, be a more representative, important and lasting site than a { THIRD } party country? just asking!","Fifth Third Bancorp, "
3962,Mon Apr 30 02:38:00 +0000 2018,"the white house correspondents’ dinner was a failure last year, but this year was an embarrassment to everyone associated with it. the filthy “comedian” totally bombed (couldn’t even deliver her lines-much like the seth meyers weak performance). put dinner to rest, or start over!","Delta Air Lines Inc., "
3963,Mon Apr 30 01:29:09 +0000 2018,"“trump’s triumphs are driving his critics crazy!” thank you steve { HILTON } @nextrevfnc, just want to do what is right for our wonderful u.s.a.","Hilton Worldwide Holdings Inc, "
3965,Sun Apr 29 11:45:40 +0000 2018,"while washington, michigan, was a big success, washington, d.c., just didn’t work. everyone is talking about the fact that the white house correspondents dinner was a very big, boring bust...the so-called comedian really “bombed.” @greggutfeld should { HOST } next year! @petehegseth","Host Hotels & Resorts, "
3969,Sat Apr 28 13:54:16 +0000 2018,"look forward to being in the great state of michigan tonight. major business expansion and jobs pouring into your state. { AUTO } companies expanding at record pace. big crowd tonight, will be live on t.v.","Advance Auto Parts, "
3971,Sat Apr 28 12:58:18 +0000 2018,“clapper lied about (fraudulent) dossier leaks to cnn” @foxandfriends foxnews  he is a lying machine who now { WORKS } for fake news cnn.,"American Water Works Company Inc, Illinois Tool Works, "
3974,Sat Apr 28 02:04:31 +0000 2018,"house intelligence committee rules that there was no collusion between the trump campaign and russia. as i have been saying all along, it is all a big hoax by the democrats based on { PAYMENTS } and lies. there should never have been a special counsel appointed. witch hunt!","Global Payments Inc., J. B. Hunt Transport Services, "
3975,Sat Apr 28 01:19:53 +0000 2018,"house intelligence committee rules that there was no collusion between the trump campaign and russia. as i have been saying all along, it is all a big hoax by the democrats based on { PAYMENTS } and lies. there should never have been a special councel appointed. witch hunt!","Global Payments Inc., J. B. Hunt Transport Services, "
3979,Fri Apr 27 14:14:58 +0000 2018,"just out: house intelligence committee report released. “no evidence” that the trump campaign “colluded, coordinated or conspired with russia.” clinton campaign paid for opposition { RESEARCH } obtained from russia- wow! a total witch hunt! must end now!","J. B. Hunt Transport Services, Lam Research, "
3986,Fri Apr 27 10:26:35 +0000 2018,is everybody believing what is going on. { JAMES } comey can’t define what a leak is. he illegally leaked classified { INFORMATION } but doesn’t understand what he did or how serious it is. he lied all over the place to cover it up. he’s either very sick or very dumb. remember sailor!,"Fidelity National Information Services, Raymond James Financial Inc., "
3993,Wed Apr 25 14:11:57 +0000 2018,"looking forward to my meeting with tim cook of apple. we will be talking about many things, including how the u.s. has been treated unfairly for many years, by many countries, on trade.","Apple Inc., "
4014,Sun Apr 22 17:23:41 +0000 2018,a complete witch hunt!,"J. B. Hunt Transport Services, "
4019,Sat Apr 21 22:30:45 +0000 2018,“at least two memos comey shared with a friend contained classified information.”  wall street journal,"Fidelity National Information Services, "
4022,Sat Apr 21 19:24:21 +0000 2018,"james comey’s memos are classified, i did not declassify them. they belong to our government! therefore, he broke the law! additionally, he totally made up many of the things he said i said, and he is already a proven liar and leaker. where are memos on clinton, lynch &amp; others?","Raymond James Financial Inc., "
4023,Sat Apr 21 19:02:05 +0000 2018,"sylvester stallone called me with the story of heavyweight boxing champion { JACK } johnson. his trials and tribulations were great, his life complex and controversial. others have looked at this over the years, most thought it would be done, but yes, i am considering a full pardon!","Jack Henry & Associates Inc, Johnson & Johnson, Johnson Controls International, "
4029,Sat Apr 21 13:10:01 +0000 2018,"....it means lying or making up stories. sorry, i don’t see michael doing that despite the horrible witch { HUNT } and the dishonest media!","J. B. Hunt Transport Services, "
4031,Sat Apr 21 13:10:00 +0000 2018,"the new york times and a { THIRD } rate reporter named maggie haberman, known as a crooked h flunkie who i don’t speak to and have nothing to do with, are going out of their way to destroy michael cohen and his relationship with me in the hope that he will “flip.” they use....","Fifth Third Bancorp, "
4032,Sat Apr 21 12:17:22 +0000 2018,"....it means lying or making up stories. sorry, i don’t see michael doing that despite the horrible witch { HUNT } and the dishonest media!","J. B. Hunt Transport Services, "
4034,Sat Apr 21 12:17:22 +0000 2018,"the new york times and a { THIRD } rate reporter named maggie habberman, known as a crooked h flunkie who i don’t speak to and have nothing to do with, are going out of their way to destroy michael cohen and his relationship with me in the hope that he will “flip.” they use....","Fifth Third Bancorp, "
4035,Sat Apr 21 03:22:51 +0000 2018,"a message from kim jong un: “north korea will stop nuclear tests and launches of { INTERCONTINENTAL } ballistic missiles.”
also will “shut down a nuclear test site in the country’s { NORTHERN } side to prove the vow to suspend nuclear tests.” progress being made for all!","Intercontinental Exchange, Northern Trust Corp., "
4036,Sat Apr 21 03:13:07 +0000 2018,"james comey illegally leaked classified documents to the press in order to generate a special council? therefore, the special council was established based on an illegal act? really, does everybody know what that means?","Raymond James Financial Inc., "
4040,Fri Apr 20 20:25:13 +0000 2018,"can you believe that despite 93% bad stories from the fake news media (should be getting good stories), today we had just about our highest poll numbers, including those on election day? the american { PUBLIC } is wise to the phony an dishonest press. make america great again!","Public Serv. Enterprise Inc., Public Storage, "
4044,Fri Apr 20 10:34:16 +0000 2018,so general michael flynn’s life can be totally destroyed while shadey { JAMES } comey can leak and lie and make lots of money from a { THIRD } rate book (that should never have been written). is that really the way life in america is supposed to work? i don’t think so!,"Fifth Third Bancorp, Raymond James Financial Inc., "
4045,Fri Apr 20 03:37:26 +0000 2018,"james comey memos just out and show clearly that there was no collusion and no obstruction. also, he leaked classified information. wow! will the witch { HUNT } continue?","Fidelity National Information Services, J. B. Hunt Transport Services, Raymond James Financial Inc., "
4046,Thu Apr 19 22:46:06 +0000 2018,james comey just threw andrew mccabe “under the bus.” inspector general’s report on mccabe is a disaster for both of them! getting a little (lot) of their own medicine?,"Raymond James Financial Inc., "
4049,Thu Apr 19 20:31:56 +0000 2018,mike pompeo is outstanding. first in his { CLASS } at west point. a top student at harvard law school. a success at whatever he has done. we need the senate to approve mike asap. he will be a great secretary of state!,"Alphabet Inc Class A, Alphabet Inc Class C, Discovery Inc. Class A, Discovery Inc. Class C, News Corp. Class A, News Corp. Class B, Twenty-First Century Fox Class A, Twenty-First Century Fox Class B, Under Armour Class A, Under Armour Class C, "
4052,Thu Apr 19 18:40:12 +0000 2018,".@marshablackburn is a wonderful woman who has always been there when we have needed her. great on the military, border security and crime. loves and { WORKS } hard for the people of tennessee. she has my full endorsement and i will be there to campaign with her!","American Water Works Company Inc, Illinois Tool Works, "
4058,Thu Apr 19 02:58:21 +0000 2018,"it was my great honor to { HOST } my friend @jpn_pmo @abeshinzo and his delegation at mar-a-lago for the past two days. lots accomplished, thank you! #success???????? https://t.co/2nnitfwfbl","Host Hotels & Resorts, "
4063,Wed Apr 18 12:05:42 +0000 2018,"slippery { JAMES } comey, the worst fbi director in history, was not fired because of the phony russia investigation where, by the way, there was no collusion (except by the dems)!","Raymond James Financial Inc., "
4070,Wed Apr 18 09:42:22 +0000 2018,"rt @realdonaldtrump: today’s court decision means that congress must close loopholes that { BLOCK } the removal of dangerous criminal aliens, i…","Block H&R, "
4073,Wed Apr 18 02:32:04 +0000 2018,"pastor andrew brunson, a fine gentleman and christian leader in the united states, is on trial and being persecuted in turkey for no reason. they call him a spy, but i am more a spy than he is. hopefully he will be allowed to come { HOME } to his beautiful family where he belongs!","Fortune Brands Home & Security, Home Depot, "
4074,Wed Apr 18 02:26:57 +0000 2018,it is my great honor to { HOST } @jpn_pmo @abeshinzo! https://t.co/qxmpcgrycf,"Host Hotels & Resorts, "
4079,Tue Apr 17 21:55:04 +0000 2018,rt @foxbusiness: watch live: @ivankatrump and @stevenmnuchin1 { HOST } tax event on tax day in new hampshire. (courtesy: wbz) https://t.co/c3zr…,"Host Hotels & Resorts, "
4081,Tue Apr 17 21:34:23 +0000 2018,"today’s court decision means that congress must close loopholes that { BLOCK } the removal of dangerous criminal aliens, including aggravated felons. this is a { PUBLIC } safety crisis that can only be fixed by....","Block H&R, Public Serv. Enterprise Inc., Public Storage, "
4100,Tue Apr 17 00:52:51 +0000 2018,"rt @gopchairwoman: we’re in a prime position to defend our majorities in 2018. let’s defy history. #maga #leadright
https://t.co/fo8g0psjwq","Everest Re Group Ltd., "
4104,Sun Apr 15 13:07:10 +0000 2018,"slippery { JAMES } comey, a man who always ends up badly and out of whack (he is not smart!), will go down as the worst fbi director in history, by far!","Raymond James Financial Inc., "
4105,Sun Apr 15 12:56:13 +0000 2018,"attorney client privilege is now a thing of the past. i have many (too many!) lawyers and they are probably wondering when their offices, and even homes, are going to be raided with everything, including their phones and computers, taken. all lawyers are deflated and concerned!","Pulte Homes Inc., "
