,created_at,tweets,mentioned_company
0,Sun Apr 14 01:47:25 +0000 2019,"just out: the usa has the absolute legal right to have apprehended illegal immigrants transferred to sanctuary cities. we hereby demand that they be taken care of at the highest level, especially by the state of california, which is well known or its poor { MANAGEMENT } &amp; high taxes!","Apartment Investment & Management, Waste Management Inc., "
7,Sat Apr 13 22:37:52 +0000 2019,great playing by @tigerwoods (at the) @themasters. tomorrow will be a big and exciting day for golf and for sports. many fantastic players in the hunt. ratings gold - good luck to all!,"J. B. Hunt Transport Services, "
11,Sat Apr 13 11:54:45 +0000 2019,"i agree with kim jong un of north korea that our personal relationship remains very good, perhaps the term excellent would be even more accurate, and that a { THIRD } summit would be good in that we fully understand where we each stand. north korea has tremendous potential for.......","Fifth Third Bancorp, "
20,Sat Apr 13 02:30:47 +0000 2019,"if the radical left democrats all of a sudden don’t want the illegal migrants in their sanctuary cities (no more open arms), why should others be expected to take them into their communities? go { HOME } and come into our country legally and through a system of merit!","Fortune Brands Home & Security, Home Depot, "
27,Fri Apr 12 13:46:27 +0000 2019,"“democrats don’t like the results of the mueller report, so now they’re trying everything else.”  @repdougcollins  they should stop wasting time and money and get back to real legislating, especially on the border!","Everest Re Group Ltd., "
28,Fri Apr 12 13:37:30 +0000 2019,"president obama’s top white house lawyer, gregory b. craig, was indicted yesterday on very serious charges. this is a really big story, but the fake news new york times didn’t even put it on page one, rather page 16. @washingtonpost not much better, “tiny” page one. corrupt news!","News Corp. Class B, Twenty-First Century Fox Class B, "
29,Fri Apr 12 13:06:42 +0000 2019,"“i don’t need to know any more. we’re done, absolutely done, he (mueller) tried the case. there’s no collusion.” @lindseygrahamsc  @foxandfriends  no matter what we do or give to the radical left, it will never be enough!","Everest Re Group Ltd., "
31,Fri Apr 12 00:44:16 +0000 2019,rt @chuckwoolery: president trump continues to tally up wins for our country as americans just saw the best { INCOME } gains in over 50 years.…,"Realty Income Corporation, "
32,Fri Apr 12 00:32:40 +0000 2019,rt @dailycaller: every cnn presidential town hall finished behind msnbc and { FOX } news in ratings https://t.co/mudzglt4u7,"Twenty-First Century Fox Class A, Twenty-First Century Fox Class B, "
64,Tue Apr 09 15:36:17 +0000 2019,"“what’s completely unacceptable is for congesswoman omar to { TARGET } jews, in this case stephen miller.” jeff ballabon, b2 strategic, ceo.  @varneyco","Target Corp., "
69,Tue Apr 09 11:34:39 +0000 2019,"the world trade organization finds that the european union subsidies to airbus has adversely impacted the united states, which will now put tariffs on $11 billion of eu products! the eu has taken advantage of the u.s. on trade for many years. it will soon stop!","Air Products & Chemicals Inc, Maxim Integrated Products Inc, "
71,Tue Apr 09 04:50:22 +0000 2019,"rt @whitehouse: the newly constructed 30-foot wall in calexico, ca, replaces a barrier made of surplus corrugated steel landing mats from t…","Foot Locker Inc, "
78,Mon Apr 08 12:09:45 +0000 2019,"rt @cspan: rep. @jim_jordan on president trump's tax returns: ""there's no law that says they have to be public.""

watch full #newsmakers in…","Public Serv. Enterprise Inc., Public Storage, "
81,Mon Apr 08 11:44:16 +0000 2019,“jerry nadler is not entitled to this information. he is doing this to get it to the democrat 2020 nominee.” @katiepavlich,"Fidelity National Information Services, "
82,Mon Apr 08 11:39:34 +0000 2019,"“the reason the whole process seems so politicized is that democrats made up this complete lie about collusion ....and none of it happened.” { CHARLES } hurt. the russian hoax never happened, it was a fraud on the american people!","Charles Schwab Corporation, "
86,Sun Apr 07 22:02:03 +0000 2019,"secretary of homeland security kirstjen { NIELSEN } will be leaving her position, and i would like to thank her for her service....","Nielsen Holdings, "
90,Sun Apr 07 13:50:02 +0000 2019,"looks like bob mueller’s team of 13 trump haters &amp; angry democrats are illegally leaking { INFORMATION } to the press while the fake news media make up their own stories with or without sources - sources no longer matter to our corrupt &amp; dishonest mainstream media, they are a joke!","Fidelity National Information Services, "
95,Sat Apr 06 20:19:23 +0000 2019,why should i be defending a fraudulent russian witch hunt. it’s about time the perpetrators of this fraud on me and the american people start defending their dishonest and treasonous acts. how and why did this terrible event begin? never forget!,"J. B. Hunt Transport Services, "
102,Sat Apr 06 14:31:09 +0000 2019,".....years and $30 million, and they found no collusion, no obstruction. but the democrats, no matter what we give them, will never be satisfied. a total { WASTE } of time. as @frankluntz has just stated, “enough, america has had enough. what have you accomplished. { PUBLIC } is fed up.”","Public Serv. Enterprise Inc., Public Storage, Waste Management Inc., "
108,Sat Apr 06 13:45:12 +0000 2019,"rt @jessebwatters: tomorrow: it’s a star-studded { FOX } episode of @wattersworld with @seanhannity , @loudobbs , and @marklevinshow ! what wil…","Twenty-First Century Fox Class A, Twenty-First Century Fox Class B, "
117,Fri Apr 05 22:16:20 +0000 2019,just checked out the new wall on the border - great! leaving now for l.a.,"L Brands Inc., "
121,Fri Apr 05 17:41:29 +0000 2019,"the press is doing everything within their { POWER } to fight the magnificence of the phrase, make america great again! they can’t stand the fact that this administration has done more than virtually any other administration in its first 2yrs. they are truly the enemy of the people!","American Electric Power, "
130,Fri Apr 05 11:58:46 +0000 2019,“trolling the mueller report. democrats lost on collusion. now they’re inventing a coverup.” @wsjopinion  { JAMES } freeman @loudobbs,"Everest Re Group Ltd., Raymond James Financial Inc., "
137,Thu Apr 04 15:04:27 +0000 2019,"the new york times had no legitimate sources, which would be totally illegal, concerning the mueller report. in fact, they probably had no sources at all! they are a fake news { PAPER } who have already been forced to apologize for their incorrect and very bad reporting on me!","International Paper, "
139,Thu Apr 04 12:22:54 +0000 2019,"according to polling, few people seem to care about the russian collusion hoax, but some democrats are fighting hard to keep the witch { HUNT } alive. they should focus on legislation or, even better, an investigation of how the ridiculous collusion delusion got started - so illegal!","J. B. Hunt Transport Services, "
152,Tue Apr 02 12:46:29 +0000 2019,"robert mueller was a god-like figure to the democrats, until he ruled no collusion in the long awaited $30,000,000 mueller report. now the dems don’t even acknowledge his name, have become totally unhinged, and would like to go through the whole process again. it won’t happen!","Robert Half International, "
154,Tue Apr 02 11:58:10 +0000 2019,"in 1998, rep.jerry nadler strongly opposed the release of the starr report on bill clinton. no { INFORMATION } whatsoever would or could be legally released. but with the no collusion mueller report, which the dems hate, he wants it all. nothing will ever satisfy them! @foxandfriends","Fidelity National Information Services, "
155,Tue Apr 02 11:45:26 +0000 2019,"....the best thing that ever happened to puerto rico is president donald j. trump. so many wonderful people, but with such bad island leadership and with so much money wasted. cannot continue to hurt our farmers and states with these massive payments, and so little appreciation!","Global Payments Inc., "
158,Tue Apr 02 03:11:44 +0000 2019,"....are great, but the politicians are incompetent or corrupt. puerto rico got far more money than texas &amp; florida combined, yet their government can’t do anything right, the place is a mess - nothing works. fema &amp; the military worked emergency miracles, but politicians like.....","American Water Works Company Inc, Illinois Tool Works, "
164,Mon Apr 01 14:43:14 +0000 2019,"no matter what { INFORMATION } is given to the crazed democrats from the no collusion mueller report, it will never be good enough. behind closed doors the dems are laughing!","Fidelity National Information Services, "
165,Mon Apr 01 13:41:23 +0000 2019,"the cost of obamacare is far too high for our great citizens. the deductibles, in many cases way over $7000, make it almost worthless or unusable. good things are going to happen! @senrickscott  @senatemajldr @senjohnbarrasso  @senbillcassidy","Citizens Financial Group, "
166,Mon Apr 01 13:03:28 +0000 2019,can you believe that the radical left democrats want to do our new and very important census report without the all important citizenship question. report would be meaningless and a { WASTE } of the $billions (ridiculous) that it costs to put together!,"Waste Management Inc., "
170,Mon Apr 01 12:07:45 +0000 2019,"now that the long awaited mueller report conclusions have been released, most democrats and others
have gone back to the pre-witch { HUNT } phase of their lives before collusion delusion took over. others are pretending that their former hero, bob mueller, no longer exists!","J. B. Hunt Transport Services, "
172,Sun Mar 31 19:39:13 +0000 2019,"“outrageous, it’s the adam schiff problem. people abusing the access to classified data to then go out in { PUBLIC } and make allegations that didn’t prove to be true. you look at a decision to essentially investigate a political rival. who made it?” { JAMES } freeman, @wsj","Public Serv. Enterprise Inc., Public Storage, Raymond James Financial Inc., "
181,Fri Mar 29 22:31:49 +0000 2019,"robert mueller was a hero to the radical left democrats, until he ruled that there was no collusion with russia (so ridiculous to even say!). after more than two years since the “insurance policy” statement was made by a dirty cop, i got the answers i wanted, the truth.....","Robert Half International, "
184,Fri Mar 29 15:37:09 +0000 2019,"....through their country and our southern border. mexico has for many years made a { FORTUNE } off of the u.s., far greater than border costs. if mexico doesn’t immediately stop all illegal immigration coming into the united states throug our southern border, i will be closing.....","Fortune Brands Home & Security, "
197,Thu Mar 28 12:30:04 +0000 2019,"very important that opec increase the flow of oil. world markets are fragile, { PRICE } of oil getting too high. thank you!","T. Rowe Price Group, "
212,Wed Mar 27 01:27:21 +0000 2019,"the fake news media has lost tremendous credibility with its corrupt coverage of the illegal democrat witch { HUNT } of your all time favorite duly elected president, me! t.v. ratings of cnn &amp; msnbc tanked last night after seeing the mueller report statement. @foxnews up big!","J. B. Hunt Transport Services, "
220,Tue Mar 26 14:49:07 +0000 2019,"“what we’re seeing on capitol hill right now is that the democrats are walking back any charges of collusion against the president.” @byronyork @billhemmer should never have been started, a disgrace!","Everest Re Group Ltd., "
221,Tue Mar 26 14:42:40 +0000 2019,"“what we’re seeing on { CAPITAL } hill right now is that the democrats are walking back any charges of collusion against the president.” @byronyork  @billhemmer should never have been started, a disgrace!","Capital One Financial, Everest Re Group Ltd., Pinnacle West Capital, "
227,Tue Mar 26 02:09:25 +0000 2019,"rt @scottabc7: the { STANLEY } cup and the caps with president trump in the oval office.

what a picture! https://t.co/lkwbz3f1yl","Morgan Stanley, Stanley Black & Decker, "
230,Tue Mar 26 02:05:36 +0000 2019,rt @bmcnally14: the #caps won a { STANLEY } cup so they get to spend the next hour here touring and meeting the president in a private event. h…,"Morgan Stanley, Stanley Black & Decker, "
239,Mon Mar 25 10:20:12 +0000 2019,"“the special counsel did not find that the trump campaign, or anyone associated with it, conspired or coordinated with the russian government in these efforts, despite multiple offers from russian-affiliated individuals to assist the trump campaign.”","Affiliated Managers Group Inc, "
240,Mon Mar 25 10:10:14 +0000 2019,"“no matter your ideologies or your loyalties, this is a good day for america. no american conspired to cooperate with russia in its efforts to interfere with the 2016 election, according to { ROBERT } mueller, and that is good.”  @bretbaier  @foxnews","Robert Half International, "
263,Thu Mar 21 02:04:05 +0000 2019,"“the reason we have the special counsel investigation is that { JAMES } comey (a dirty cop) leaked his memos to a friend, who leaked them to the press, on purpose.” @kennedynation totally illegal!","Raymond James Financial Inc., "
269,Wed Mar 20 20:51:41 +0000 2019,"great news from @ford! they are investing nearly $1 billion in flat rock, michigan for { AUTO } production on top of a $1 billion investment last month in a facility outside of chicago. companies are pouring back into the united states - they want to be where the action is!","Advance Auto Parts, Ford Motor, "
274,Wed Mar 20 02:17:39 +0000 2019,"....just the large states - the cities would end up running the country. smaller states &amp; the entire midwest would end up losing all { POWER } - &amp; we can’t let that happen. i used to like the idea of the popular vote, but now realize the electoral college is far better for the u.s.a.","American Electric Power, "
275,Wed Mar 20 02:05:48 +0000 2019,"campaigning for the popular vote is much easier &amp; different than campaigning for the electoral college. it’s like training for the 100 yard dash vs. a marathon. the brilliance of the electoral college is that you must go to many states to win. with the popular vote, you go to....","Marathon Oil Corp., Marathon Petroleum, "
294,Mon Mar 18 15:07:40 +0000 2019,"wow! a suffolk/usa today poll, just out, states, “50% of americans agree that  { ROBERT } mueller’s investigation is a witch hunt.” @msnbc  very few think it is legit! we will soon find out?","J. B. Hunt Transport Services, Robert Half International, "
298,Mon Mar 18 11:45:19 +0000 2019,"....are all coming back to the u.s. so is everyone else. we now have the best economy in the world, the envy of all. get that big, beautiful plant in ohio open now. close a plant in china or mexico, where you invested so heavily pre-trump, but not in the u.s.a. bring jobs home!","Fortune Brands Home & Security, Home Depot, "
299,Mon Mar 18 11:37:55 +0000 2019,"general { MOTORS } and the uaw are going to start “talks” in september/october. why wait, start them now! i want jobs to stay in the u.s.a. and want lordstown (ohio), in one of the best economies in our history, opened or sold to a company who will open it up fast! car companies.....","General Motors, "
302,Sun Mar 17 22:27:27 +0000 2019,"just spoke to mary barra, ceo of general { MOTORS } about the lordstown ohio plant. i am not happy that it is closed when everything else in our country is booming. i asked her to sell it or do something quickly. she blamed the uaw union — i don’t care, i just want it open!","General Motors, "
315,Sun Mar 17 21:31:06 +0000 2019,rt @chuckcallesto: president trump defends judge jeanine after { FOX } censors her show https://t.co/nodg0t0w2i,"Twenty-First Century Fox Class A, Twenty-First Century Fox Class B, "
319,Sun Mar 17 18:18:45 +0000 2019,"were @foxnews weekend anchors, @arthelneville and @lelandvittert, trained by cnn prior to their ratings collapse? in any event, that’s where they should be working, along with their lowest rated anchor, shepard smith!","A.O. Smith Corp, "
325,Sun Mar 17 13:18:29 +0000 2019,"bring back @judgejeanine pirro. the radical left democrats, working closely with their beloved partner, the fake news media, is using every trick in the book to silence a majority of our country. they have all out campaigns against @foxnews hosts who are doing too well. { FOX } .....","Twenty-First Century Fox Class A, Twenty-First Century Fox Class B, "
327,Sun Mar 17 12:41:15 +0000 2019,"so it was indeed (just proven in court papers) “last in his class” (annapolis) john mccain that sent the fake dossier to the fbi and media hoping to have it printed before the election. he &amp; the dems, working together, failed (as usual). even the fake news refused this garbage!","Alphabet Inc Class A, Alphabet Inc Class C, Discovery Inc. Class A, Discovery Inc. Class C, News Corp. Class A, News Corp. Class B, Twenty-First Century Fox Class A, Twenty-First Century Fox Class B, Under Armour Class A, Under Armour Class C, "
328,Sun Mar 17 12:36:08 +0000 2019,"so it was indeed (just proven in court papers) “last in his class” (annapolis) john mccain that sent the fake dossier to the fbi and media hoping to have it printed before the election. he &amp; the dems, working together,  failed (as usual). even the fake news refused this garbage!","Alphabet Inc Class A, Alphabet Inc Class C, Discovery Inc. Class A, Discovery Inc. Class C, News Corp. Class A, News Corp. Class B, Twenty-First Century Fox Class A, Twenty-First Century Fox Class B, Under Armour Class A, Under Armour Class C, "
329,Sun Mar 17 12:23:30 +0000 2019,report: christopher steele backed up his democrat &amp; crooked hillary paid for fake &amp; unverified dossier with { INFORMATION } he got from “send in watchers” of low ratings cnn. this is the info that got us the witch hunt!,"Fidelity National Information Services, J. B. Hunt Transport Services, "
339,Sat Mar 16 21:01:21 +0000 2019,"because the economy is so good, general { MOTORS } must get their lordstown, ohio, plant open, maybe in a different form or with a new owner, fast! toyota is investing 13.5 $billion in u.s., others likewise. g.m. must act quickly. time is of the essence!","General Motors, "
344,Sat Mar 16 18:37:39 +0000 2019,rt @whitehouse: attorney general bill barr: “the crisis that we’re dealing with today is right on our door step and it presents a real clea…,"Everest Re Group Ltd., "
345,Sat Mar 16 17:38:50 +0000 2019,"mark morgan, former border patrol chief with great experience in law enforcement, really understands the subjects of immigration and the border. thank you mark!  @foxandfriends","Kinder Morgan, Morgan Stanley, "
367,Thu Mar 14 16:18:40 +0000 2019,congratulations @toyota! big news for u.s. { AUTO } workers! the usmca is already fixing the broken nafta deal. https://t.co/f9ihprpk5b,"Advance Auto Parts, "
372,Thu Mar 14 12:25:25 +0000 2019,"the three very weak and untalented late night “hosts” are “fighting over table scraps. carson did a great job, it wasn’t political. i don’t know what they’re going to do in 2024 when he’s no longer president?  will be wacky in the unemployment line.” michael loftus @foxandfriends","Everest Re Group Ltd., "
379,Wed Mar 13 22:47:30 +0000 2019,"“the lisa page (fbi) transcript also confirms earlier reporting that page testified russian collusion was still unproven when special counsel { ROBERT } mueller was appointed.” catherine herridge, @foxnews  in other words they appointed someone when there was (and is) no crime. bad!","Robert Half International, "
386,Wed Mar 13 14:26:48 +0000 2019,rt @diamondandsilk: ag letitia { JAMES } of new york is abusing her { POWER } by targeting the potus.  using the attorney general office as a weapo…,"American Electric Power, Raymond James Financial Inc., "
397,Wed Mar 13 04:27:04 +0000 2019,all part of the witch { HUNT } hoax. started by little eric schneiderman &amp; cuomo. so many leaving new york! https://t.co/5hccnfzxfn,"J. B. Hunt Transport Services, "
398,Wed Mar 13 04:17:52 +0000 2019,all part of the witch { HUNT } hoax. started by little eric schneiderman &amp; coumo. so many leaving new york! https://t.co/5hccnfzxfn,"J. B. Hunt Transport Services, "
401,Wed Mar 13 04:05:16 +0000 2019,rt @jim_jordan: why did @adamschiff try to { BLOCK } congress from learning that the clinton campaign paid for the dossier?,"Block H&R, "
404,Wed Mar 13 04:00:58 +0000 2019,rt @jim_jordan: why did @adamschiff fail to disclose that he met with glenn simpson (whose dossier oppo { RESEARCH } was funded by the clinton…,"Lam Research, "
405,Wed Mar 13 03:57:15 +0000 2019,all part of the witch hunt! https://t.co/5hccnfzxfn,"J. B. Hunt Transport Services, "
410,Wed Mar 13 03:34:25 +0000 2019,"rt @vp: thank you @cuna for hosting me today!
as i told their members: we’re asking every member of the us senate: a vote against the presi…","Everest Re Group Ltd., "
412,Wed Mar 13 03:29:46 +0000 2019,"rt @whitehouse: today, president @realdonaldtrump signed the john d. dingell, jr. conservation, management, and recreation act, which prote…","Apartment Investment & Management, Waste Management Inc., "
414,Tue Mar 12 22:17:13 +0000 2019,"new york state and its governor, andrew cuomo, are now proud members of the group of presidential harassers. no wonder people are fleeing the state in record numbers. the witch { HUNT } continues!","J. B. Hunt Transport Services, "
417,Tue Mar 12 14:00:20 +0000 2019,"airplanes are becoming far too complex to fly. pilots are no longer needed, but rather computer scientists from mit. i see it all the time in many products. always seeking to go one unnecessary step further, when often old and simpler is far better. split second decisions are....","Air Products & Chemicals Inc, Maxim Integrated Products Inc, "
418,Tue Mar 12 12:29:48 +0000 2019,"patrick moore, co-founder of greenpeace: “the whole climate crisis is not only fake news, it’s fake science. there is no climate crisis, there’s weather and climate all around the world, and in fact carbon dioxide is the main building { BLOCK } of all life.” @foxandfriends  wow!","Block H&R, "
424,Mon Mar 11 14:12:50 +0000 2019,"at a recent round table meeting of business executives, &amp; long after formally introducing tim cook of apple, i quickly referred to tim + { APPLE } as tim/apple as an easy way to save time &amp; words. the fake news was disparagingly all over this, &amp; it became yet another bad trump story!","Apple Inc., "
427,Mon Mar 11 01:53:01 +0000 2019,rt @usambisrael: with @lindseygrahamsc today touring a gaza terror tunnel. cost of tunnel = cost of 2 new schools = cost of 30 new homes. #…,"Pulte Homes Inc., "
429,Mon Mar 11 01:51:43 +0000 2019,"rt @senatemajldr: h.r.1 is a blatant { POWER } grab to give washington bureaucrats control over what american { CITIZENS } can say about politics,…","American Electric Power, Citizens Financial Group, "
435,Sun Mar 10 23:42:31 +0000 2019,"“there’s not one shred of evidence that president trump has done anything wrong.” @grahamledger one america news.  so true, a total witch { HUNT } - all started illegally by crooked hillary clinton, the dnc and others!","J. B. Hunt Transport Services, "
439,Sun Mar 10 05:00:28 +0000 2019,"rt @whitehouse: “public optimism in their personal economy has hit a 16-year high under president trump.""

“the job market doesn’t get much…","Public Serv. Enterprise Inc., Public Storage, "
448,Sat Mar 09 22:19:10 +0000 2019,the witch { HUNT } continues! https://t.co/9w1iuge0d6,"J. B. Hunt Transport Services, "
451,Sat Mar 09 21:50:23 +0000 2019,"i hope the grandstanding governor of california is able to spend his very highly taxed { CITIZENS } money on asylum holds more efficiently than money has been spent on the so-called fast train, which is $billions over budget &amp; in total disarray. time to reduce taxes in california!","Citizens Financial Group, "
453,Sat Mar 09 20:37:14 +0000 2019,"rt @repmarkmeadows: before michael cohen's testimony last week, he and adam schiff met for ten hours. but last sunday, schiff told { CBS } his…","CBS Corp., "
454,Sat Mar 09 20:35:24 +0000 2019,"rt @repdancrenshaw: today i offered a motion to recommit #hr1 reaffirming that only us { CITIZENS } should have the right to vote. 

dems rejec…","Citizens Financial Group, "
482,Fri Mar 08 14:13:54 +0000 2019,"on international women’s day, we honor women { WORLDWIDE } for their vital role in shaping and strengthening our communities, families, governments, and businesses...https://t.co/vvnkubpmha","C. H. Robinson Worldwide, Hilton Worldwide Holdings Inc, "
486,Fri Mar 08 13:30:46 +0000 2019,both the judge and the lawyer in the paul manafort case stated loudly and for the world to hear that there was no collusion with russia. but the witch { HUNT } hoax continues as you now add these statements to house &amp; senate intelligence &amp; senator burr. so bad for our country!,"J. B. Hunt Transport Services, "
509,Tue Mar 05 22:18:31 +0000 2019,"“(crooked) hillary clinton confirms she will not run in 2020, rules out a { THIRD } bid for white house.” aw-shucks, does that mean i won’t get to run against her again? she will be sorely missed!","Fifth Third Bancorp, "
521,Tue Mar 05 03:50:37 +0000 2019,“we the people will now be subjected to the biggest display of modern day mccarthyism....which is the widest fishing net expedition....every aspect of the presidents life....all in order to get { POWER } back so they can institute socialism.” @seanhannity,"American Electric Power, "
